{
  "schema_version": "1.0.0",
  "library": "tailwind",
  "platform": "angular",
  "tracks": [
    {
      "id": "angular-22-tailwind-4",
      "status": "candidate",
      "requirements": {
        "node": ">=22.22.3 <23",
        "bun": ">=1.3.14 <2",
        "nx": ">=23.1.0 <24",
        "framework": ">=22.0.0 <23"
      },
      "packages": {
        "@tailwindcss/postcss": "4.3.3",
        "tailwindcss": "4.3.3"
      },
      "dependency_section": "devDependencies",
      "catalog": "default",
      "reason": "Piste Tailwind 4 ; vérification complète requise pour chaque nouvelle version effective du framework.",
      "verification": null
    }
  ]
}
