{
  "schema_version": "1.0.0",
  "library": "angular-material",
  "platform": "angular",
  "tracks": [
    {
      "id": "angular-22",
      "status": "candidate",
      "requirements": {
        "node": ">=22.22.3 <23",
        "bun": ">=1.3.14 <2",
        "nx": ">=23.1.0 <24",
        "framework": ">=22.0.0 <23"
      },
      "packages": {
        "@angular/cdk": "22.2.4",
        "@angular/material": "22.2.4"
      },
      "dependency_section": "dependencies",
      "catalog": "default",
      "reason": "Piste Angular Material 22 ; vérification complète requise pour chaque nouvelle combinaison framework/Material.",
      "verification": null
    }
  ]
}
